jobTitle,position,description,skills,location,jobId,status,priority,priceType,workType,jobType,combined_text
Node js developer,development,"Developing and maintaining all server-side network components.
Ensuring optimal performance of the central database and responsiveness to front-end requests.
Collaborating with front-end developers on the integration of elements.
Designing customer-facing UI and back-end services for various business processes.
Developing high-performance applications by writing testable, reusable, and efficient code.
Implementing effective security protocols, data protection measures, and storage solutions.
Running diagnostic tests, repairing defects, and providing technical support.
Documenting Node.js processes, including database schemas, as well as preparing reports.
Recommending and implementing improvements to processes and technologies.
Keeping informed of advancements in the field of Node.js development.","{""Node js"",""Type script"",""Mango DB"",AWS,Microservice}","{""Ahmedabad, Hyderabad, Remote (preferable from Pune or Delhi)""}",JDNJ1082,Active,Medium,INR,Work from Office,Permanent,developing maintaining network component ensuring optimal performance central database responsiveness request collaborating developer integration element designing ui service various business process developing application writing testable reusable efficient code implementing effective security protocol data protection measure storage solution running diagnostic test repairing defect providing technical support documenting process including database schema well preparing report recommending implementing improvement process technology keeping informed advancement field development node j type script mango db aws microservice
Network Operations Center Engineer,Network Operations Center Engi,"Handle the diagnosis and correction of infrastructure problems.  Troubleshoots network problems in timely manner.  Provide internal analysis and support to ensure proper criticality during outages or periods of degraded system performance.  Participate in the infrastructure design, monitoring and documentation process. Ensure issues are identified, tracked, reported on and resolved in a timely manner.  Provide 24*7 operational support for AMEX data center Network related changes.  Responsible for the quality of work in technical design, implementation, testing and alignment to technical compliance standards.  Provide lead support and direction to the team for the overall health and maintenance of all infrastructure assets  Skills: Needed 4+ years of experience with Routing/Switching, DNS, Load Balancing, Virtualization, Infrastructure operations support.  Hands-on experience on handling large Enterprise Networks and support.  Experienced knowledge on Network Protocols: Static, RIP, ISI","{NOC,Routing,Switching}",{Gurgaon},JDNO9328,Active,High,INR,Work from Office,Permanent,handle diagnosis correction infrastructure problem troubleshoots network problem timely manner provide internal analysis support ensure proper criticality outage period degraded system performance participate infrastructure design monitoring documentation process ensure issue identified tracked reported resolved timely manner provide operational support amex data center network related change responsible quality work technical design implementation testing alignment technical compliance standard provide lead support direction team overall health maintenance infrastructure asset skill needed year experience dns load balancing virtualization infrastructure operation support experience handling large enterprise network support experienced knowledge network protocol static rip isi noc routing switching
O2C AR Sr Process Associate,O2C AR Sr Process Associate,"O2C Cash Apps – Sr Associate  SHIFT: 3 PM to 12 AM  JOB DESCRIPTION  •             Manage cash applications, Collections, Billing and Master records maintenance team.  •             Monitoring DSO to provide some analysis.  •             Single point of contact for client level escalation and management escalation  •             BRS consolidating for all intercompany and bank accounts.  •             Proper approval hierarchy is followed  •             Adhered to compliance policy  MANDATORY SKILLS  Excellent Communications skill Good with Microsoft tools. Experience in Accounts Receivable domain Willing to work in Rotational Shift.","{O2C,""Accounts Receivable"",""cash apps""}",{Bengaluru},JDOA2530,Active,High,INR,Work from Office,Permanent,cash apps sr associate shift pm job description manage cash application collection billing master record maintenance team monitoring dso provide analysis single point contact client level escalation management escalation br consolidating intercompany bank account proper approval hierarchy followed adhered compliance policy mandatory skill excellent communication skill good microsoft tool experience account receivable domain willing work rotational shift account receivable cash apps
Oracle Apps EBS R12 -Jr/ Technical Analyst,Oracle Apps EBS R12 -Jr/ Techn,"Roles & Responsibilities: This will client facing role, candidate should be able to answer questions","{""ORACLE R12"",""ORACLE EBS""}",{Bengaluru},JDOA3001,Active,High,INR,Work from Office,Permanent,role responsibility client facing role candidate able answer question oracle oracle eb
O2C Cash Apps - Sr Associate,O2C Cash Apps - Sr Associate,Job Description O2C Cash Apps – Sr Associate SHIFT: 3 PM to 12 AM JOB DESCRIPTION •             Mana,"{O2C,"" Cash apps""}",{Bengaluru},JDOC1601,inActive,High,INR,Work from Office,Permanent,job description cash apps sr associate shift pm job description mana cash apps
O2C Credit Management Sr PA,O2C Credit Management Sr PA,JOB DESCRIPTION  •             Identify potential bad debts & plan to reduce amount of Bad & doubtfu,"{O2C,"" Credit Management""}",{Bengaluru},JDOC9296,Active,High,INR,Work from Office,Permanent,job description identify potential bad debt plan reduce amount bad doubtfu credit management
OIC Developer,Developemnt,"Having minimum 2.5 years of relevant experience in Implementing Integration Solutions using Oracle Integration Cloud Service (OIC). Developed integration between SaaS application (Oracle Cloud ERP; Oracle Cloud HCM) and between SaaS and PaaS application. Should have worked extensively on minimum 2-4 Technology Adapters like File, Database, Oracle ERP FTP adapter. Should have excellent skill in Web Service technologies such as XML, XPath, XSLT, SOAP WSDL, and XSD. Experience in all phases of software development lifecycle from gathering requirements to documentation, testing, implementation and support. Ability to troubleshoot technical and configuration issues Should be able to communicate effectively with the functional technical groups and various technical team members Ensure completion of tasks, milestones, and components including Technical specifications design specifications, configurations, quality assurance, implementations, and project reviews Should have good debugging skills",{OIC},{Remote},JDOD1412,Active,High,INR,Work from Home,Permanent,minimum year relevant experience implementing integration solution using oracle integration cloud service oic developed integration saas application oracle cloud erp oracle cloud hcm saas paas application worked extensively minimum technology adapter like file database oracle erp ftp adapter excellent skill web service technology xml xpath xslt soap wsdl xsd experience phase software development lifecycle gathering requirement documentation testing implementation support ability troubleshoot technical configuration issue able communicate effectively functional technical group various technical team member ensure completion task milestone component including technical specification design specification configuration quality assurance implementation project review good debugging skill oic
Oracle Apps DBA/Lead Oracle Apps DBA,OracleDBA,"Oracle application patching (adpatch and adop )
Cloning 12.1.3 and 12.2.5 EBS
CPU and PSU patching exposure and experience.
Trouble shooting experience in application EBS.
Weblogic 12c administration and maintenance.
Rman backup and restore ( duplicate database, creating standby )
Oracle application sysadmin management ( defining CM, user management , profiles etc)
Experience as a APPS DBA with Oracle database versions 9i,10g ,11g and 12c
Basic to advanced knowledge of Windows 2000/NT and Unix server technologies.
Experience in advanced features like DataGaurd ,RAC, ASM
Shared Application file system and SSO/OAM ( good to have)
Experience in Oracle Applications Migration from one server to other servers and EBS Upgradation.
Good to have OTM ,AWS and Oracle Cloud services administration knowledge.
Shell scription.","{Oracle,""cloud services"",EBS}",{bangalore},JDOD4187,Active,High,INR,Work from Office,Contract,oracle application patching adpatch adop cloning eb cpu psu patching exposure experience trouble shooting experience application eb weblogic administration maintenance rman backup restore duplicate database creating standby oracle application sysadmin management defining cm user management profile etc experience apps dba oracle database version basic advanced knowledge window unix server technology experience advanced feature like datagaurd rac asm shared application file system good experience oracle application migration one server server eb upgradation good otm aws oracle cloud service administration knowledge shell scription oracle cloud service eb
Oracle DBA,Developemnt,  They are responsible for validating and evaluating database and database solutions so that the rest of Amex can use the database in their solutions.,"{""Oracle DBA""}",{Remote},JDOD9260,Active,Medium,INR,Work from Home,Contract Hire,responsible validating evaluating database database solution rest amex use database solution oracle dba
Oracle ERP Cloud Analyst - Finance (OTC),Oracle ERP Cloud Analyst - OTC,"Job Description Experience: 8+ Yrs  Shift Time: 1 PM to 9 PM (But should be flexible stretch if required)  Notice Period: Immediate to Max 15 days  Job Requirement:  •    8 + years’ experience in Oracle EBS/ERP. •    5 + Years functional exp in Oracle ERP Cloud is must with Quote to Cash business Process knowledge. •    5+ Years design, configuration and solution exp in Oracle Cloud modules such as (Subscription Management, Contract, Account Receivables Collections, Customer Master, RMCS)     •    PPM and GL exp highly desired •    Proven experience in designing custom, end-user solutions. •    In addition to technical expertise, a sound understanding of business processes and e2eintegration is a critical skill. •    Strong process improvement skills. •    Strong organizational skills and some project management experience required. •    Motivated self-starter with ability to work independently, adapt to changing priorities, •    Handle multiple assignments. •    Ability to collaborate","{""Oracle EBS"",""Oracle Cloud""}",{Bengaluru},JDOE8722,Active,High,INR,Work from Office,Permanent,job description experience yr shift time pm pm flexible stretch required notice period immediate max day job requirement year experience oracle year functional exp oracle erp cloud must quote cash business process knowledge year design configuration solution exp oracle cloud module subscription management contract account receivables collection customer master rmcs ppm gl exp highly desired proven experience designing custom solution addition technical expertise sound understanding business process critical skill strong process improvement skill strong organizational skill project management experience required motivated ability work independently adapt changing priority handle multiple assignment ability collaborate oracle eb oracle cloud
Oracle Fusion Technical Consultant,Oracle Fusion Technical Consultant,Hands-on experience in working with BI Publisher custom templates & OTBI Reports development with so,"{"" Bi Publisher"",OTBI,"" oracle cloud fusion"",""Sandbox "",""Oracle HCM ""}",{Bangalore},JDOF4954,Active,High,INR,Work from Office,Permanent,experience working bi publisher custom template otbi report development bi publisher otbi oracle cloud fusion sandbox oracle hcm
Oracle Financial Techno-Functional ,Developemnt,"Responsibilities: • Provide technical and functional support to clients for issues related to month end and other financial issues • Work closely with clients to understand their business processes and provide solutions that meet their needs • Debug and maintain Oracle applications modules, including General Ledger, Accounts Payable, Accounts Receivable, Fixed Assets, etc. • Debug and fix custom reports and interfaces using Oracle tools • Provide data fixes and code fixes as required","{""Oracle EBS""}",{Remote},JDOF8153,Active,Medium,INR,Work from Home,Contract,responsibility provide technical functional support client issue related month end financial issue work closely client understand business process provide solution meet need debug maintain oracle application module including general ledger account payable account receivable fixed asset etc debug fix custom report interface using oracle tool provide data fix code fix required oracle eb
O2C Lead,seniorLead,"• Multi-faceted experience in (End to End O2C) - Collections (B2C) & (B2B), Cash applications & Customer Master Maintenance (CMM),credit Management ,credit control. 
• Coaching, Training and Guiding new employees in a positive direction to ensure industry success. 
• Expertise in effective management of customer relation operations and ensuring maximum customer satisfaction through providing quality service and ensuring adherence to service quality norms. 
• Experience in end-to-end set up of a process targets, SLA by data analysis with historical data and proposing the derived targets to clients. Operations Management
• Approve request for creation/changes of customer master data. 
• Experience in international debt collection. 
• Manage bad debt write off in accordance with the credit Policy. 
• Follow up with regional collections supervisors & track status of collections. 
• Analyze and review data received from credit agency and financial sttments of new customer toassign credit li","{""SAP,Oracle,SQF,Citrix""}",{bangalore},JDOL1071,Active,High,INR,Work from Office,Permanent,experience end end collection cash application customer master maintenance cmm credit management credit control coaching training guiding new employee positive direction ensure industry success expertise effective management customer relation operation ensuring maximum customer satisfaction providing quality service ensuring adherence service quality norm experience set process target sla data analysis historical data proposing derived target client operation management approve request customer master data experience international debt collection manage bad debt write accordance credit policy follow regional collection supervisor track status collection analyze review data received credit agency financial sttments new customer toassign credit li sap oracle sqf citrix
Operations Manager,Operations Manager,"Job Description Job Title: Operations Manager  Location: Noida (Work from office) Salary: 8-11 LPA max Experience: 7-12 Years Notice Period: Immediate - 30 Days max Interview process: 3 rounds of interviews, 1 telephonic and 2 video interviews  Manadatory skills: Excelent communication skills, Client Management, Team Management   What’s the role? • Are you a pro at organizing and streamlining processes? • Can you multitask like a boss while staying calm and focused? • Do you have an insatiable appetite for learning new technologies, eye for detail and a commitment to delivering highquality, time sensitive work? • As an individual, do you rate yourself as dependable, efficient communicator, organizer and highly adaptable?  Does this sounds like you? Sweet. Read on!  We're an outsourcing company on a mission to revolutionize the way people work, and we're looking for a dynamic, creative and A-list operations manager to join our team. If you're the type of person who thrives in a fast-pac","{""Team Management"",""Project Management"",""Client Interaction""}",{Noida},JDOM4007,Active,High,INR,Work from Office,Permanent,job description job title operation manager location noida work office salary lpa max experience year notice period immediate day max interview process round interview telephonic video interview manadatory skill excelent communication skill client management team management role pro organizing streamlining process multitask like bos staying calm focused insatiable appetite learning new technology eye detail commitment delivering highquality time sensitive work individual rate dependable efficient communicator organizer highly adaptable sound like sweet read outsourcing company mission revolutionize way people work looking dynamic creative operation manager join team type person thrives team management project management client interaction
O2C AM/Sr Am,O2C AM/Sr Am,"JOB DESCRIPTION              Cash forecast and revenue recognition for the period. Follow up with regional collections supervisors & track status of collections. Manage bad debt write off in accordance with the credit Policy. Manage Cash Application and billing error log. Manage cash applications, Collections, Billing and Master records maintenance team. Analyse, Approve and assign credit limit and payment terms to new customer’s accounts. Prepare monthly Accounts Receivable & Credit Management report for all regions and share with regional controllers. Prepare credit backlog report and action plan for sales orders on blocked status. Monitoring on DSO level of the company Monitor Reconciliation of all bank statements with general ledger accounts related to accounts receivables. Revenue Recognition and Reconciliation for respective region. Adhoc tasks as and when required.   MANDATORY SKILLS  Client Servicing :-  Managing customer centric operations & ensuring client satisfaction by ach","{O2C,"" "",""cash applications"",""""}",{Bengaluru},JDOS2227,Active,High,INR,Work from Office,Permanent,job description cash forecast revenue recognition period follow regional collection supervisor track status collection manage bad debt write accordance credit policy manage cash application billing error log manage cash application collection billing master record maintenance team analyse approve assign credit limit payment term new customer account prepare monthly account receivable credit management report region share regional controller prepare credit backlog report action plan sale order blocked status monitoring dso level company monitor reconciliation bank statement general ledger account related account receivables revenue recognition reconciliation respective region adhoc task required mandatory skill client servicing managing customer centric operation ensuring client satisfaction ach cash application
Oracle SCM Techno Functional,Developemnt,"Responsibilities: • Provide technical and functional support to clients for issues related to SCM issues • Work closely with clients to understand their business processes and provide solutions that meet their needs • Debug and maintain Oracle applications modules, including Inventory, WIP, Order Management, Purchasing, iSupplier & iProcurement • Debug and fix custom reports and interfaces using Oracle tools • Provide data fixes and code fixes as required   Qualifications: • Minimum 10 years of experience working on Oracle Applications specific modules like Inventory, WIP, Order Management, Purchasing, iSupplier & iProcurement • Strong functional background in Oracle SCM • Very Strong technical skills in PL/SQL, OAF, Workflow, Forms & Reports • Experience in providing data fixes and code fixes • Excellent communication and interpersonal skills, with the ability to work collaboratively with clients and team members  Desired Qualifications: • Experience working with Oracle EBS R11 ","{""Oracle SCM""}",{Remote},JDOS4834,Active,High,Dollar/USD,Work from Home,Contract,responsibility provide technical functional support client issue related scm issue work closely client understand business process provide solution meet need debug maintain oracle application module including inventory wip order management purchasing isupplier iprocurement debug fix custom report interface using oracle tool provide data fix code fix required qualification minimum year experience working oracle application specific module like inventory wip order management purchasing isupplier iprocurement strong functional background oracle scm strong technical skill oaf workflow form report experience providing data fix code fix excellent communication interpersonal skill ability work collaboratively client team member desired qualification experience working oracle eb oracle scm
Process associate,Process associate,"Job Details: 1) Oracle RAC/ASM installation , Configuration and troubleshooting (RAC experience is a must for at least 2+ years) 2) Oracle RDBMS installation and Upgrades 3) Experience on 12c,19c 4) Oracle DB backups (RMAN, hot backups , cold backups) 5) Database Refresh 6) Data pump( export/import) 7) Tablespace Management 8) User Management 9) DB Locks and Session Management 10) TKPROF,AWR,ASH,SQL PLAN and SQL Profiles etc 11) OEM 12) Shell Scripting 13) Experience in Oracle Database in Windows Environment is added bonus","{""Oracle DBA"","" ""}",{wwqihqf},JDPA2186,Active,High,INR,Work from Home,Permanent,job detail oracle installation configuration troubleshooting rac experience must least year oracle rdbms installation upgrade experience oracle db backup rman hot backup cold backup database refresh data pump tablespace management user management db lock session management tkprof awr ash sql plan sql profile etc oem shell scripting experience oracle database window environment added bonus oracle dba
Process associate,Process associate,wagwagage,"{sfsagfagas,asvsadgsag}",{Hywjhva},JDPA2263,Active,Low,INR,Work from Home,Contract,wagwagage sfsagfagas asvsadgsag
Process Associate Payroll Associate,PApayrollassociate,"Basic payroll knowledge on APAC,EMEA countries.
• Demonstrated ability to understand internal controls with a strong focus on attention to detail.
• Experience managing a third-party payroll vendor.
• Experience of dealing with key stakeholders (HR, IT, Finance)
• Significant progressively responsible experience in a similar role within a fast-paced environment
• A sense of urgency in solving inquiries and requests to ensure timely resolution and an ability to work effectively under pressure.
• Excellent analytical and problem solving with confidence to make decisions and manage escalations• Must be highly engaging, confident communicator and detail orientated.
• Experience on ADP SPM, ADP workforce and Ceridian Dayforce
• B. Com / M.Com with 1-3 years relevant experience.
• Strong verbal and written communication skill.
• Team player and ability to work with strict timeline.
• Flexible to work in US shifts.
• Good in Microsoft Office.","{EMEA,""APAC payroll"",ADp,""Ceridian Dayforce"",""Microsoft Office""}",{bangalore},JDPA2423,Active,High,INR,Work from Office,Permanent,basic payroll knowledge apac emea country demonstrated ability understand internal control strong focus attention detail experience managing payroll vendor experience dealing key stakeholder hr finance significant progressively responsible experience similar role within environment sense urgency solving inquiry request ensure timely resolution ability work effectively pressure excellent analytical problem solving confidence make decision manage must highly engaging confident communicator detail orientated experience adp spm adp workforce ceridian dayforce com year relevant experience strong verbal written communication skill team player ability work strict timeline flexible work u shift good microsoft office emea apac payroll adp ceridian dayforce microsoft office
