jobTitle,position,description,skills,location,jobId,status,priority,priceType,workType,jobType,combined_text
Plant Maintenance Engineer,Plant Maintenance Engineer,"Read and understand the data from P&ID, PEFS, SLD, I/O list, line list, Cause & effect, Hazardous area classification, Alarm & Trip, F&G etc. Populating technical details from Various sources. Preparing Asset & maintenance plan data. Preparation of SPIR data. Bill of Material Build.
Immediate/30 days.
02 to 05 Years experience
Education : B.E or B.Tech - MECH/EEE/ECE/IE/ICE","{""Plant Maintenance""}",{Hyderabad},JDA&5399,Active,High,INR,Work from Office,Permanent,read understand data p id pefs sld list line list cause effect hazardous area classification alarm trip f g etc populating technical detail various source preparing asset maintenance plan data preparation spir data bill material build day year experience education plant maintenance
Adobe Analytics developer,AdobeAnalyticsdeveloper,"An understanding of the marketing technologies and their data and reporting capabilities.
Build of wireframes to present dashboards and reports in the best possible way to various different types of
stakeholders
Support managing standardization of BMC’s analytics reporting and dashboard capabilities
 Manage Quality Assurance and User Acceptance Testing the end-products and underlying data use
(correctness and completeness)
Work on all data collection platforms (website, video, advertising, social, CRM, etc.), identify and report
improvement areas, and provide support for any ad hoc report requests from stakeholders.
Provide performance analysis report with key highlights, insights &amp;amp; recommendations for future
Ability to translate data visualization requirements into wireframes and end-products for various internal
audiences.
Create data visualizations and business dashboards based on analytical data from multiple technologies.
","{""Adobe anaytics"",Agile,tableau,Marketo,""power  BI"",sprinkler}",{ChennaiBangaloreHyderabad},JDAA1476,Active,High,INR,Work from Office,Permanent,understanding marketing technology data reporting capability build wireframes present dashboard report best possible way various different type stakeholder support managing standardization bmc analytics reporting dashboard capability manage quality assurance user acceptance testing underlying data use correctness completeness work data collection platform website video advertising social crm etc identify report improvement area provide support ad hoc report request stakeholder provide performance analysis report key highlight insight amp amp recommendation future ability translate data visualization requirement wireframes various internal audience create data visualization business dashboard based analytical data multiple technology adobe anaytics agile tableau marketo power bi sprinkler
AEM architect,Aemarchitect,"To analyze, understand the client’s business use cases and technical requirements and be able to
design, build &amp; integrate AEM Platform Templates,  
Components, Services to internal and external applications.","{JIRA,Confluence,AEM}",{bangalore},JDAA5139,Active,Low,INR,Work from Office,Permanent,analyze understand client business use case technical requirement able design build amp integrate aem platform template component service internal external application jira confluence aem
Azure Administrator ,Azure Administrator ,"1.	Architecture and Design for large scale Azure hybrid cloud deployments with Azure Kubernetes Services and Azure Public Cloud  2.	Provision Dev/Test/Prod Infrastructure as code using Azure CLI, Powershell, Terraform 3.	Define the architecture for high availability, data redundancy, data loss prevention, site recovery and resilience 4.	Define and implement the architecture for high throughput and scale with capacity planning, load balancing strategies 5.	Define and implement the security architecture to ensure data security at rest and in transit, application security, key management, identity management, authentication and authorization with OIDC and OAuth2, infrastructure security with Azure VNets, NSGs, UDR, etc. 6.	Define the log analytics and monitoring architecture using Azure Monitor, Azure Application Insights 7.	Deploy infrastructure, applications and software-defined networking through CI/CD pipeline using Azure DevOps Certifications (One of the following certifications is r","{""Azure Administrator ""}","{""Pan India""}",JDAA6310,Active,High,INR,Work from Office,Permanent,architecture design large scale azure hybrid cloud deployment azure kubernetes service azure public cloud provision infrastructure code using azure cli powershell terraform define architecture high availability data redundancy data loss prevention site recovery resilience define implement architecture high throughput scale capacity planning load balancing strategy define implement security architecture ensure data security rest transit application security key management identity management authentication authorization oidc infrastructure security azure vnets nsgs udr etc define log analytics monitoring architecture using azure monitor azure application insight deploy infrastructure application networking pipeline using azure devops certification one following certification r azure administrator
AEM architect,Aemarchitect,"Should have experience in java, OSGI, Components, workflows, templates, Schedulers, fragments, ","{sling,jackrabbit,OSGI,felix,JCR}",{bangalore},JDAA7883,Active,High,INR,Work from Office,Permanent,experience java osgi component workflow template scheduler fragment sling jackrabbit osgi felix jcr
Assistant Brand Manager,Assistant Brand Manager,"Classification: All - Finance / Accounts / Investment Banking

Skills Required: Sales,Social Media Marketing,Branding,Digital Marketing,Market Analysis

Job Description
Skills needed- male candidates only, FMCG and FMCD Industry, Brand Managment, digital marketing, ATL/BTL, social media marketing, sales, communication skills, market analysis.
Location- Gurgaon (WFO)
Experience- 2-7 Years
Relevant experience- 2 years is needed
Budget- upto 9 LPA
Notice period- Immediate-30 Days (max)
Interview process- 1 virtual + 1 F2F round (need candidate from Delhi NCR only)

Job details: -
- Designing Marketing ATL/BTL activities in accordance with the Market Analysis Marketing activation and execution of Activities developed for achieving ROI as per the Business objectives.
- Handling all ATL/BTL marketing activities with ownership and responsibility.
- Marketing communication that uses mass media channels such as television, radio, print, outdoor advertising, and online media to reach a wide audience.
- Identifying & ensuring that ATL/BTL activity are done as defined & documented.
- Implementing and tracking Marketing programs for distributors and retailers designed to increase Sales, Category Presence, Brand Visibility and Brand Awareness.
- Monitoring and evaluating Marketing Programs and ATL/BTL Campaigns and activities to measure effectiveness and recommendation of improvements as needed.
- To successfully coordinate for and represent the company in onsite/offsite meetings and prestigious annual industry trade shows.
- To create congenial environment for team members and develop healthy work atmosphere.
- To coordinate with vendors and agencies for ATL/BTL activity.","{Sales,""Social Media Marketing"",Branding,""Digital Marketing"",""Market Analysis""}",{Ghargaon},JDAB3826,active,Medium,INR,Work from Office,Permanent,classification finance account investment banking skill required sale social medium marketing branding digital marketing market analysis job description skill male candidate fmcg fmcd industry brand managment digital marketing social medium marketing sale communication skill market analysis gurgaon wfo year relevant year needed upto lpa notice day max interview virtual round need candidate delhi ncr job detail designing marketing activity accordance market analysis marketing activation execution activity developed achieving roi per business objective handling marketing activity ownership responsibility marketing communication us mass medium channel television radio print outdoor advertising online medium reach wide audience identifying ensuring activity done defined documented implementing tracking marketing program distributor retailer designed increase sale category presence brand visibility brand awareness monitoring evaluating marketing program campaign activity measure effectiveness recommendation improvement needed successfully coordinate represent company meeting prestigious annual industry trade show create congenial environment team member develop healthy work atmosphere coordinate vendor agency activity sale social medium marketing branding digital marketing market analysis
Azure BI Developer - Excellerate,Azure BI Developer - Excellerate,"Resource must have 5+ years of hands on experience in Azure Cloud development (ADF)
Mandatory Strong in Azure SQL and good to have knowledge on Synapse / Analytics Experience in working on Agile Project and familiar with Scrum/SAFe ceremonies.
Defines, designs, develops and test software components/applications using Microsoft Azure- Databricks, ADF, ADL, Hive, Python, Databricks, SparkSql, PySpark.
Expertise in Azure Data Bricks, ADF, ADL, Hive, Python, Spark, PySpark
Strong T-SQL skills with experience in Azure SQL DW
Experience handling Structured and unstructured datasets
Experience in Data Modeling and Advanced SQL techniques
Experience implementing Azure Data Factory Pipelines using latest technologies and techniques.
Good exposure in Application Development.","{Azure,"" Synapse"","" ADF""}",{Hyderabad},JDAB7664,Active,High,INR,Work from Office,Permanent,resource must year hand experience azure cloud development adf mandatory strong azure sql good knowledge synapse analytics experience working agile project familiar ceremony defines design develops test software using microsoft databricks adf adl hive python databricks sparksql pyspark expertise azure data brick adf adl hive python spark pyspark strong skill experience azure sql dw experience handling structured unstructured datasets experience data modeling advanced sql technique experience implementing azure data factory pipeline using latest technology technique good exposure application development azure synapse adf
Angular Developer,Angular Developer,"Requirements
Hands-on experience in UI development using Angular.
Ability to translate UI designs into fully functional interactive prototypes.
Hands-on experience in working on Rest API based communications.
Hands-on experience in developing Web Socket.
Hands-on experience in HTML5, CSS3, JS libraries like Bootstrap.
Knowledge of SVN/Git repository.
Data visualizations using canvas or SVG, High chart, D3.js, etc.
Experience working with Jasmine, Gulp, Web Pack.
Ability to work closely with UX research and design teams.
Understanding of cross-browser compatibility and accessibility standards (W3C Guidelines).
Awareness of UI design principles and best practices.
Experience working with CSS pre-processors (SASS), Material Design.
Hands on experience in IONIC Framework would be an added advantage.","{Angular,""Rest API""}",{Hyderabad},JDAD1928,active,High,INR,Work from Office,Permanent,requirement experience ui development using angular ability translate ui design fully functional interactive prototype experience working rest api based communication experience developing web socket experience j library like bootstrap knowledge repository data visualization using canvas svg high chart etc experience working jasmine gulp web pack ability work closely ux research design team understanding compatibility accessibility standard guideline awareness ui design principle best practice experience working cs sas material design hand experience ionic framework would added advantage angular rest api
Angular Developer,Angular Developer,"Minimum Qualifications:
Bachelor's degree in computer science engineering or equivalent practical experience.
Minimum 3 years of work experience in end to end application development.
Hands on experience working in software development with one or more languages (e.g. Angular, Java, Javascript, Typescript)
Excellent command over spoken and written English required 

Preferred Qualifications:
Candidates must have experience working in server backend systems as well as web APIs.
Must be open to learn other programming languages as needed.
Must have an ability to share knowledge via mentoring, reviewing code and reviewing design.
Must have a good hold on working with Full Stack Development software and web applications.

Skills Required
Typescript
Javascript
Angular
Java
Reactjs
Any SQL databases ( MySQL, MSSQL, PostgreSQL, SQL server)",{Angular},{Hyderabad},JDAD1983,active,Hot,INR,Work from Office,Permanent,minimum qualification bachelor degree computer science engineering equivalent practical experience minimum year work experience end end application development hand experience working software development one language angular java javascript typescript excellent command spoken written english required preferred qualification candidate must experience working server backend system well web apis must open learn programming language needed must ability share knowledge via mentoring reviewing code reviewing design must good hold working full stack development software web application skill required typescript javascript angular java reactjs sql database mysql mssql postgresql sql server angular
Application Developer UNIX Shell ,ApplicationDeveloperOpensource,"Should have max 5 to 6 yrs experience (7B band)
Should have strong linux base OS 
Should have strong database exp with Oracle with wrkng knowledge of Shell scripting and PL/SQL","{""Shell scripting"",Oracle,C++,Pl/sql}",{ChennaiBangalorePune},JDAD3913,inActive,High,INR,Work from Office,Permanent,max yr experience band strong linux base o strong database exp oracle wrkng knowledge shell scripting shell scripting oracle
Angular Developer,AngularDeveloper,"Work with other team members.
Design and implement visually aesthetic user interfaces.
Identify issues with front end code and rectify them to remove bugs.
Create unit tests to ensure code is functioning as expected.
Create well written documentation.
Ensure front end code is able to query APIs.
Audit code to identify bottlenecks of performance and fixing them.
Should have  the technical ability to implement user interfaces using JavaScript and the Angular framework. 
Should  know the best practices and modern ways of creating interfaces and ensure the interface is able to interact with backend APIs. 
Should also need to have great communication and collaboration skills as you will need to interact with fellow frontend and backend developers regularly to ensure components can be integrated together.
Skills Angular framework and JavaScript.UX/UI.
",{Angular},{hyderabad},JDAD4411,Active,High,INR,Work from Home,Permanent,work team member design implement visually aesthetic user interface identify issue front end code rectify remove bug create unit test ensure code functioning expected create well written documentation ensure front end code able query apis audit code identify bottleneck performance fixing technical ability implement user interface using javascript angular framework know best practice modern way creating interface ensure interface able interact backend apis also need great communication collaboration skill need interact fellow frontend backend developer regularly ensure component integrated together skill angular framework angular
Application DeveloperLinux in versant,ApplicationDeveloperOpensource,Should have exp in C++ Development in Linux and in Versant,"{Linux,C++}",{ChennaiBangalorePune},JDAD5758,Active,High,INR,Work from Office,Permanent,exp development linux versant linux
Angular Developer,Developemnt,"Designing, coding, testing, and deploying the application. Debugging issues in the application code to ensure it is working correctly. Integrating third-party libraries with the codebase to extend its functionality. Communicating with other team members on any pending tasks or changes in the project.   Ensuring that all code complies with best practices and standards set by the company or organization they work for.",{Angular},{Hyderabad},JDAD5888,Active,Medium,INR,Work from Office,Permanent,designing coding testing deploying application debugging issue application code ensure working correctly integrating library codebase extend functionality communicating team member pending task change project ensuring code complies best practice standard set company organization work angular
Application DeveloperLinuxMySQL,ApplicationDeveloperOpensource,Should have exp in C++ Development in Linux with MYSQL,"{C++,MySQL}",{ChennaiBangalorePune},JDAD6533,Active,High,INR,Work from Office,Permanent,exp development linux mysql mysql
Angular Developer,AngularDeveloper,"Work with other team members.
Design and implement visually aesthetic user interfaces.
Identify issues with front end code and rectify them to remove bugs.
Create unit tests to ensure code is functioning as expected.
Create well written documentation.
Ensure front end code is able to query APIs.
Audit code to identify bottlenecks of performance and fixing them.
Should have  the technical ability to implement user interfaces using JavaScript and the Angular framework. 
Should  know the best practices and modern ways of creating interfaces and ensure the interface is able to interact with backend APIs. 
Should also need to have great communication and collaboration skills as you will need to interact with fellow frontend and backend developers regularly to ensure components can be integrated together.
Skills Angular framework and JavaScript.UX/UI.
",{Angular},{hyderabad},JDAD8163,Active,High,INR,Work from Home,Permanent,work team member design implement visually aesthetic user interface identify issue front end code rectify remove bug create unit test ensure code functioning expected create well written documentation ensure front end code able query apis audit code identify bottleneck performance fixing technical ability implement user interface using javascript angular framework know best practice modern way creating interface ensure interface able interact backend apis also need great communication collaboration skill need interact fellow frontend backend developer regularly ensure component integrated together skill angular framework angular
Application Developer OraclePL/SQL,ApplicationDeveloperOpensource,"
Should have exp in C,Pro C development,Oracle PL/SQL
",{C++},{BangaloreChennaiPune},JDAD8170,Active,High,INR,Work from Office,Permanent,exp c pro c development oracle 
Application DeveloperLinux,ApplicationDeveloperOpensource,Should have exp in C++ Development in Linux platform,"{C++,Linux}",{ChennaiBangalorePune},JDAD8316,Active,High,INR,Work from Office,Permanent,exp development linux platform linux
Azure Devops Engineer,Developemnt,Implementing DevOps Development Processes  ·       Design a version control strategy  ·       Integrate source control  ·       Manage build infrastructure  ·       Implement code flow  ·       Implement a mobile DevOps strategy  ·       Managing application configuration and secrets  Implementing Continuous Integration  ·       Manage code quality and security policies  ·       Implement a container build strategy  ·       Implement a build strategy  Implementing Continuous Delivery  ·       Design a release strategy  ·       Set up a release management workflow  ·       Implement an appropriate deployment pattern  Implementing Dependency Management  ·       Design a dependency management strategy  ·       Manage security and compliance  Implementing Application Infrastructure  Design an infrastructure and configuration management strategy Implement infrastructure compliance and security Implementing Continuous Feedback  Recommend and design system feedback mechanisms Implement ,"{Azure,Devops,Docker,kubernetes}",{Hyderabad},JDAD8552,Active,Medium,INR,Hybrid,Permanent,implementing devops development process design version control strategy integrate source control manage build infrastructure implement code flow implement mobile devops strategy managing application configuration secret implementing continuous integration manage code quality security policy implement container build strategy implement build strategy implementing continuous delivery design release strategy set release management workflow implement appropriate deployment pattern implementing dependency management design dependency management strategy manage security compliance implementing application infrastructure design infrastructure configuration management strategy implement infrastructure compliance security implementing continuous feedback recommend design system feedback mechanism implement azure devops docker kubernetes
Application Developer UNIX PLSQL,ApplicationDeveloperOpensource,"Should have exp in Oracle ,Pl/sql,Unix Shell Scripting
Should have max 5 to 6 yrs experience (7B band)
Should have strong linux base OS 
Should have strong database exp with Oracle with wrkng knowledge of SQL","{PL/SQL,Oracle,Linux,""Shell scripting""}",{ChennaiBangalorePune},JDAD8606,inActive,High,INR,Work from Office,Permanent,exp oracle unix shell scripting max yr experience band strong linux base o strong database exp oracle wrkng knowledge sql oracle linux shell scripting
Azure Analysis Engineer,Azure Analysis Engineer,"Job Description:

Azure Analysis Services Developer :

3.5+ to 6 Years

G4

Bang/Chennai/Pune/Mumbai

Immediate candidate only

3+ years of experience in developing tabular models in Azure Analysis Service
2+ Years of experience in Azure SQL Database
Having prior experience of building multi-dimensional model on SSAS shall be advantageous
Good T-SQL knowledge and experience
Good experience in writing DAX Queries
Experience in building hierarchies, measures in a tabular model using DAX query
 ","{""Azure Analysis""}","{""Bangalore, Chennai, Pune, Mumbai""}",JDAE2298,Active,High,INR,Work from Office,Permanent,job description azure analysis service developer year immediate candidate year experience developing tabular model azure analysis service year experience azure sql database prior experience building model ssa shall advantageous good knowledge experience good experience writing dax query experience building hierarchy measure tabular model using dax query azure analysis
AI Engineer,AIMLEngineer,"Designing machine learning systems and self-running
artificial intelligence (AI) software to automate predictive
models.
 Transforming data science prototypes and applying
appropriate ML algorithms and tools.
 Ensuring that algorithms generate accurate user
recommendations.
 Turning unstructured data into useful information by auto-
tagging images and text-to-speech conversions.
 Solving complex problems with multi-layered data sets, as
well as optimizing existing machine learning libraries and
frameworks.
 Developing ML algorithms to analyse huge volumes of
historical data to make predictions.
 Running tests, performing statistical analysis, and
interpreting test results.
Advanced proficiency with Python.
 Extensive knowledge of ML frameworks, libraries, data
structures, data modelling, and software architecture.
 In-depth knowledge of mathematics, statistics, and
algorithms.
 Superb analytical and problem-solving abilities.
 Great communication and collaboration skills.
 ","{python,""Data modelling"",AI,Statistics,""Data Structures""}",{Hyderabad},JDAE7377,Active,High,INR,Work from Home,Permanent,designing machine learning system artificial intelligence ai software automate predictive model transforming data science prototype applying appropriate ml algorithm tool ensuring algorithm generate accurate user recommendation turning unstructured data useful information tagging image conversion solving complex problem data set well optimizing existing machine learning library framework developing ml algorithm analyse huge volume historical data make prediction running test performing statistical analysis interpreting test result advanced proficiency python extensive knowledge ml framework library data structure data modelling software architecture knowledge mathematics statistic algorithm superb analytical ability great communication collaboration skill python data modelling ai statistic data structure
Aggregation Engineer,Aggregation Engineer,"Bachelor’s or Master’s degree in Computer Science or Engineering, 3-4 (Only In Between Not more than or Less ) years hands on Experience in Java Experience in frameworks like Spring, Hibernate; Experience in Web App technologies (HTML, CSS, JavaScript, jQuery) Competence in Linux platform; Having knowledge of Xpath, regex Familiarity in Maven, Git Familiarity of Continuous Integration tools (Jenkins etc) Familiarity in Unit Testing (Junit) Familiarity in Selenium","{""Java Developer"",Spring,Hibernate,""Unit Testing""}",{Bangalore},JDAE8888,Active,Medium,INR,Work from Office,Permanent,bachelor master degree computer science engineering le year hand experience java experience framework like spring hibernate experience web app technology html cs javascript jquery competence linux platform knowledge xpath regex familiarity maven git familiarity continuous integration tool jenkins etc familiarity unit testing junit familiarity selenium java developer spring hibernate unit testing
