jobTitle,position,description,skills,location,jobId,status,priority,priceType,workType,jobType,combined_text
SSE  Database Administrator ,Developemnt,"Mandatory skills – Must be working on SQLX version, Must know to write Query, Excellent DBA knowledge.   Operations team (Production Support) position   Supporting multiple customers in multiple SQL Server environments   Environments are on premise, hosting and in the cloud   Performance troubleshooting   Health Checks   Architecture design   General production support   Phone support of technologies   Some Dev opportunities available  Requirements:  What you bring to your new team   Minimum 10 years SQL Server 2016, 2017, 2019 DBA experience (senior level)   Minimum 7 years as a Production DBA   Must communicate clearly and effectively both verbally and written   Must be able to demonstrate the ability to troubleshoot and research technical issues   High-level problem determination and resolution skills   Deployment and upgrade of engine and clients   Experience with SSIS Packages, T-SQL, stored procedures, triggers, views, constraints and  functions","{SQL,DBA,SSIS}","{""Mumbai Kolkata""}",JDS3428,Active,Medium,INR,Work from Office,Permanent,mandatory skill must working sqlx version must know write query excellent dba knowledge operation team production support position supporting multiple customer multiple sql server environment environment premise hosting cloud performance troubleshooting health check architecture design general production support phone support technology dev opportunity available requirement bring new team minimum year sql server dba experience senior level minimum year production dba must communicate clearly effectively verbally written must able demonstrate ability troubleshoot research technical issue problem determination resolution skill deployment upgrade engine client experience ssis package stored procedure trigger view constraint function sql dba ssis
 Sr. Oracle Cloud Technical Consultant, Sr. Oracle Cloud Technical Consultant,"Should have worked on both Oracle Cloud and Oracle EBS (R12).
Minimum 1 year of experience into Oracle Finance Cloud
Should have excellent communication skills.
Experience in Finance module.
Integration experience with FloQast, Concur, Workday, ADP, Stripe is desirable.
Good to have experience in Supply Chain Management.
Hands on building technical reports (OTBI, Fusion Reports, SQL)
Build & execute SQL queries to extract data from ERP or other enterprise systems
Must have Fusion cloud ERP experience","{""Oracle Cloud"",""Oracle EBS (R12)"",""Oracle Finance Cloud"",""Finance module"",Integration,""SQL queries "",""Fusion cloud ERP "",""Supply Chain Management""}",{Bangalore},JDS5247,Active,High,INR,Work from Office,Permanent,worked oracle cloud oracle eb minimum year experience oracle finance cloud excellent communication skill experience finance module integration experience floqast concur workday adp stripe desirable good experience supply chain management hand building technical report otbi fusion report sql build execute sql query extract data erp enterprise system must fusion cloud erp experience oracle cloud oracle eb oracle finance cloud finance module integration sql query fusion cloud erp supply chain management
 Sr.Oracle Cloud Finance Functional Consultant ,Sr.Oracle Cloud Finance Functional Consultant,"•	Should have worked on both Oracle Cloud and Oracle EBS (R12).
•	Minimum 1 year of experience into Oracle Finance Cloud
•	Should have excellent communication skills.
•	Experience in Finance module.
•	Integration experience with FloQast, Concur, Workday, ADP, Stripe is desirable.
•	Good to have experience in Supply Chain Management.","{""Oracle Cloud and Oracle EBS (R12)"",""Oracle Finance Cloud"",""Finance module"",Integration,""Supply Chain Management""}",{Bangalore},JDS9557,Active,High,INR,Work from Office,Permanent,worked oracle cloud oracle eb minimum year experience oracle finance cloud excellent communication skill experience finance module integration experience floqast concur workday adp stripe desirable good experience supply chain management oracle cloud oracle eb oracle finance cloud finance module integration supply chain management
Sr Associate FP&A,Sr Associate FP&A,"Responsibilities: 1) Financial Analysis and Reporting: •    Conduct comprehensive financial analysis, including budgeting, forecasting, variance analysis, and trend analysis. •    Generate insightful financial reports, presentations, and dashboards to communicate key findings and recommendations to senior management. •    Analyse financial data to identify areas for cost optimization, revenue enhancement, and process improvement. •    Collaborate with cross-functional teams to ensure accurate and timely financial reporting.  2) Budgeting and Forecasting: •    Lead the annual budgeting process, working closely with department heads to develop detailed budget plans. •    Develop and maintain accurate financial forecasts based on market trends, historical data, and business insights. •    Monitor budget performance and provide regular reports to management, highlighting areas of concern or opportunities for improvement. •    Assist in the development of financial models and scenarios to s","{""Financial Analysis"",Forecasting,""CA qualified""}",{Bangalore},JDSA1495,Active,High,INR,Work from Office,Permanent,responsibility financial analysis reporting conduct comprehensive financial analysis including budgeting forecasting variance analysis trend analysis generate insightful financial report presentation dashboard communicate key finding recommendation senior management analyse financial data identify area cost optimization revenue enhancement process improvement collaborate team ensure accurate timely financial reporting budgeting forecasting lead annual budgeting process working closely department head develop detailed budget plan develop maintain accurate financial forecast based market trend historical data business insight monitor budget performance provide regular report management highlighting area concern opportunity improvement assist development financial model scenario financial analysis forecasting ca qualified
Software Asset Management (SAM) Sales,Software Asset Management (SAM,"Own Business role of generating Software Asset Management (SAM) Sales in Named Large Corporate & Enterprise accounts as an independent contributor, through direct interaction with Multiple members in the client environment, farming the account for SAM cases.   	  DETAILED JOB DESCRIPTION: - Take ownership of and drive business relationship with large corporate enterprises (named accounts) sniffing the SAM requirements in the account, proposing solutions for identified cases, leading Client thru Sales Cycle, Negotiating & Closing cases, as an independent contributor.  - Be able to directly interact across levels at client side, especially with officials from the IT team, User teams, Projetc teams and IT Infra teams.  - Person should be driven by numbers and be able to independently take ownership of sales closures in the named accounts. - The person will own sales numbers & should have a track record of delivering on same.      WORK EXPERIENCE REQUIREMENTS:  - 5 to10 years of Direct Sales Experience in SAM sales with large corporate/ enterprise clients, with direct responsibility for Revenue/Profitability, having personally managed the client relationship. 
- Should have track record of having met sales numbers in earlier stints thru sales to large Corporate Clients.","{""SAM Sales"",SaaS,B2B,""Lead Generation""}",{Mumbai},JDSA2626,Active,High,INR,Work from Office,Permanent,business role generating software asset management sam sale named large corporate enterprise account independent contributor direct interaction multiple member client environment farming account sam case detailed job description take ownership drive business relationship large corporate enterprise named account sniffing sam requirement account proposing solution identified case leading client thru sale cycle negotiating closing case independent contributor able directly interact across level client side especially official team user team projetc team infra team person driven number able independently take ownership sale closure named account person sale number track record delivering work experience requirement year direct sale experience sam sale large enterprise client direct responsibility personally managed client relationship track record met sale number earlier stint thru sale large corporate client sam sale saas lead generation
Salesforce Architect- astria digital,SalesforceArchitect,"10+ years experience of in totalStrong problem solving and communication skillUnderstanding of Salesforce architecture, licensing model and best practicesStrong understanding of NFR, SF best practices and governor limitsHave directly involved in managing the releases of various salesforce applications - with deep-dive understanding of packages and change sets
Have hands-on experience working with Salesforce API [ Tooling API , Metadata API, Canvas , Rest/ SOAP API ,Bulk API etc.,] and Lightning developmentStrong with configuration, customization, programming with APEX, APEX Triggers, Visual force, Chatter etcKnowledge of Salesforce1, Marketing cloud awareness will be an added advantageClosely work with different Customers to understand their business and technical requirements mainly during initial phase of the project.
Suggest best suitable design, licenses and implementation approaches for scalable and robust application.
Ensure the quality of deliverables from technology perspective","{salesforce,""Data Migration"",XML,SalesforceArchitect,Visualforce,SFDC,Lightening}",{hyderabad},JDSA4109,inActive,High,INR,Work from Office,Permanent,year experience totalstrong problem solving communication skillunderstanding salesforce architecture licensing model best practicesstrong understanding nfr sf best practice governor limitshave directly involved managing release various salesforce application understanding package change set experience working salesforce api tooling api metadata api canvas soap api bulk api lightning developmentstrong configuration customization programming apex apex trigger visual force chatter etcknowledge marketing cloud awareness added advantageclosely work different customer understand business technical requirement mainly initial phase project suggest best suitable design license implementation approach scalable robust application ensure quality deliverable technology perspective salesforce data migration xml salesforcearchitect visualforce sfdc lightening
SAP ABAP ,SAP ABAP ,"You will design, develop, and support application solutions with focus on SAP ABAP. You may also design, develop and/or re-engineer highly complex application components and integrate software packages, programs and reusable objects residing on multiple platforms. You will need to mentor junior & fresher to enable them to meet customer expectations. Required Technical and Professional Expertise: Minimum 5+ years of experience in SAP ABAP development Hands on experience on S/4 HANA Working knowledge on ABAP Object Oriented Programming. Development expertise in RICEF (Reports, Interfaces, Conversions, Enhancements, Forms and Reports) Experience in BAPI, Module pool, Debugging Techniques. Expertise in Print technologies: SAP Scripts, Smart forms & Adobe Forms Advance ABAP Enhancement Techniques Working experience on integration technologies: ALE/IDOC, ODATA, External API, RFC (Remote Function Call) Capability to communicate with customer independently. Preferred Technical and Professional","{""SAP ABAP"",""S/4 HANA"",""ABAP Object Oriented Programming""}",{Noida},JDSA4395,Active,High,INR,Work from Office,Permanent,design develop support application solution focus sap abap may also design develop highly complex application component integrate software package program reusable object residing multiple platform need mentor junior fresher enable meet customer expectation required technical professional expertise minimum year experience sap abap development hand experience hana working knowledge abap object oriented programming development expertise ricef report interface conversion enhancement form report experience bapi module pool debugging technique expertise print technology sap script smart form adobe form advance abap enhancement technique working experience integration technology odata external api rfc remote function call capability communicate customer independently preferred technical professional sap abap hana abap object oriented programming
Sr.Technical Analyst RPA Dev-Support,Sr.Technical Analyst RPA Dev-Support,"Job Description
Experience: 5 to 8 Yrs

Job Location: Bangalore (Work from Home)

Shift Time: 3 PM to 12 AM

Notice Period: Immediate

Skills Required: RPA-Ui Path, Orchestrator good to have, SQL, Agile Framework, Good to know - Automation Anywhere (RPA)

Job Details:

Minimum 3+ years Hands-on experience with independently developing UiPath RPA solutions.
Should be ready to handle support tasks.
Good to have Orchestrator knowledge.
Experience in PDF, Email, Excel, website Automations using UiPath, and computer vision and document understanding module.
Should be able to write/understand basic SQL
Should be independent creating the project documents.
Should be fast debugging production issue and resolving them.
Should have experience in TTD and process flow.
Should have experience in support and maintenance of production bots
Should be able to work independently end to end, right from automation feasibility, Design, coding, testing and deployment on automating the Process in the Automation Tool
Good knowledge or at least basic knowledge of technical skills in any coding language C#/Java, VB Script, Excel VBA (Excel Macros)
Experience in agile development practice
Should have good communication skills.","{""UiPath RPA solutions"",""Orchestrator good to have"",SQL,""Agile Framework""}",{Bangalore},JDSA6419,active,High,INR,Work from Home,Permanent,job description experience yr job location bangalore work home shift time pm notice period immediate skill required path orchestrator good sql agile framework good know automation anywhere rpa job detail minimum year experience independently developing uipath rpa solution ready handle support task good orchestrator knowledge experience pdf email excel website automation using uipath computer vision document understanding module able basic sql independent creating project document fast debugging production issue resolving experience ttd process flow experience support maintenance production bot able work independently end end right automation feasibility design coding testing deployment automating process automation tool good knowledge least basic knowledge technical skill coding language c vb script excel vba excel macro experience agile development practice good communication skill uipath rpa solution orchestrator good sql agile framework
SeniorLead associate manager RPAUI path,SeniorLeadAssociateManager,"6+ years of overall experienceShould have at least 3+ Yrs into Ui Path.Should have worked as acting team lead.Should have excellent communication skills.Candidate will be a part of the 3 membered team and also should work as IC role.
Hands-on experience with independently developing UiPath RPA solutions
Strong understanding of UiPath and Automation Anywhere or other leading RPA products, RPA specific methodologies, standards and best practices.Experience following and implementing design and coding standards and good practices
Supporting User Acceptance Testing and production deploymentAssisting with developing and demonstrating POCs for clientsKnowledge of Agile software development lifecycle, and experience with applying change control procedures.Assisting with developing and demonstrating POCs for clients","{""RPA/UI path"",Agile,Sql,""Automation RPA""}",{bangalore},JDSA6500,inActive,High,INR,Work from Office,Permanent,year overall experienceshould least yr ui worked acting team excellent communication part membered team also work ic role experience independently developing uipath rpa solution strong understanding uipath automation anywhere leading rpa product rpa specific methodology standard best following implementing design coding standard good practice supporting user acceptance testing production deploymentassisting developing demonstrating pocs clientsknowledge agile software development lifecycle experience applying change control developing demonstrating pocs client path agile sql automation rpa
Salesforce Developer,SalesforceDeveloper,"Manage the technical delivery of custom development, integrations, and data
migration elements of a Salesforce implementation.
• Familiar with source code, version management, and code deployment standards.
• Ability to understand a project and deep dive to debug issues.
• Liaise with Salesforce product teams to support client implementations.
• Working remotely, while collaborating with global teams for delivery across
geographies. We may need you to be flexible with your work hours.6+ years hands-on development experience on the Salesforce platform.
• Understanding of the Salesforce product suite, including Sales, Service, Community,
Marketing, and Community Clouds.
• Strong JavaScript/Front end Skills.
• Strong LWC or Aura development skills.
• Knowledge on various asynchronous capabilities in salesforce and its use cases
• Strong expertise on web service.
• Need to have clear understanding of MVC architecture.
• Understanding of systems architecture and ability to design scalable performance-
driven solutions.","{salesforce,""marketing clouds"",SFDC,Javascript,""visualforce APIS"",Apex,""DML techniques""}",{hyderabad},JDSA7048,inActive,High,INR,Work from Office,Permanent,manage technical delivery custom development integration data migration element salesforce implementation familiar source code version management code deployment standard ability understand project deep dive debug issue liaise salesforce product team support client implementation working remotely collaborating global team delivery across geography may need flexible work year development experience salesforce platform understanding salesforce product suite including sale service community marketing community cloud strong end skill strong lwc aura development skill knowledge various asynchronous capability salesforce use case strong expertise web service need clear understanding mvc architecture understanding system architecture ability design scalable driven solution salesforce marketing cloud sfdc javascript visualforce apis apex dml technique
Salesforce Admin,Salesforce Admin,"Classification: All - Finance / Accounts / Investment Banking

Skills Required: Salesforce

Job Description
Total and Relevant year of experience : Total-5 and relevant- 4.5
Mandatory Skills: Salesforce Admin, Salesforce CPQ
Salary: 20 to 25 LPA
Notice Period: Immediate - 30 Days
Location: Remote
Interview process: Virtual
Any other specifications: We cannot consider JNTU & Osmania university candidates


What it takes to catch our eye
Highly productive: Ability to be highly productive with little oversight on day to day basis. This role is intended for somebody who will take meaningful responsibility and initiative for shaping and executing upon our strategy and operations.
Strong blend of business sense and technical chops: You evaluate things holistically and think through the objectives, impacts, best practices, and what will be simple and scalable.
Work with analysts and cross-functional team to configure CPQ and build scalable solutions on the Salesforce platform.
High-energy, company first, positive attitude: Passionate and motivated to make a massive impact and work hard in a fast-paced environment.
Multi-tasking prioritization expertise: Experience (and preferably an enjoyment of) balancing numerous different priorities and demands.
Ability to communicate effectively and interact with cross-functional teams

Ideal Background
Rockstar advanced Salesforce.com administrator background with Steelbrick CPQ, Sales and Service cloud.
Salesforce CPQ and advance administrator certification are required.
5+ Years’ experience administering Salesforce platform and leveraging the power of platform by building point & click applications.
Experience with multiple Salesforce CPQ implantations
BS in Computer Science, Engineering, or a related technical discipline.
 ","{""Salesforce Admin"",""Salesforce CPQ""}",{Abhaneri},JDSA8400,active,High,INR,Work from Home,Permanent,classification finance account investment banking skill required salesforce job description total relevant year experience mandatory skill salesforce admin salesforce cpq salary lpa notice period immediate day location remote interview process virtual specification consider jntu osmania university candidate take catch eye highly productive ability highly productive little oversight day day basis role intended somebody take meaningful responsibility initiative shaping executing upon strategy operation strong blend business sense technical chop evaluate thing holistically think objective impact best practice simple scalable work analyst team configure cpq build scalable solution salesforce platform company first positive attitude passionate motivated make massive impact work hard environment prioritization expertise experience preferably enjoyment balancing numerous different priority demand ability communicate effectively interact team ideal background rockstar advanced administrator background steelbrick cpq sale service cloud salesforce cpq advance administrator certification required year experience administering salesforce platform leveraging power platform building point click application experience multiple salesforce cpq implantation b computer science engineering related technical discipline salesforce admin salesforce cpq
Sr.Tech Analyst  - Dell Boomi ,Sr.Tech Analyst  - Dell Boomi ,Designation : Sr.Tech Analyst  - Dell Boomi  Shift: 3 PM to 12 midnight (PST time overlap required) Total Exp: 6-8 years Band: A3 Job Location : Bangalore ( Ecity) Mode of work : Work from Home / Work from Office. Notice period : Immediate    Mandatory Skill set        Boomi Developer with 6-8 years of experience working as a middleware developer with a minimum of 3 years’ experience on Boomi Good knowledge of ERP (Oracle Cloud) and CRM (SF) systems from an integration target perspective is required.   Job details:   Boomi Developer with 6-8 years of experience working as a middleware developer with a minimum of 3 years’ experience on Boomi. Good knowledge of ERP (Oracle Cloud) and CRM (SF) systems from an integration target perspective is required. Good Communication skills and ability to independently work in a team of developers. Boomi certification in the last 2 years is desirable. Should have experience with both On-Prem and Cloud version of Boomi. Experience working on support ti,"{""Dell Boomi certification "",""ERP (Oracle Cloud)"",""CRM (SF) integration ""}",{Bangalore},JDSA8840,Active,High,INR,Work from Office,Permanent,designation analyst dell boomi shift pm midnight pst time overlap required total exp year band job location bangalore ecity mode work work home work office notice period immediate mandatory skill set boomi developer year experience working middleware developer minimum year experience boomi good knowledge erp oracle cloud crm sf system integration target perspective required job detail boomi developer year experience working middleware developer minimum year experience boomi good knowledge erp oracle cloud crm sf system integration target perspective required good communication skill ability independently work team developer boomi certification last year desirable experience cloud version boomi experience working support ti dell boomi certification erp oracle cloud crm sf integration
Sr Tech Analyst Oracle DBA,Sr Tech Analyst Oracle DBA,"Job Details:  1) Oracle RAC/ASM installation , Configuration and troubleshooting  (RAC experience is a must for at least 2+ years) 2) Oracle RDBMS installation and Upgrades 3) Experience on 12c,19c 4) Oracle DB backups (RMAN, hot backups , cold backups) 5) Database Refresh 6) Data pump( export/import) 7) Tablespace Management 8) User Management 9) DB Locks and Session Management 10) TKPROF,AWR,ASH,SQL PLAN and SQL Profiles etc 11) OEM 12) Shell Scripting 13) Experience in Oracle Database in Windows Environment is added bonus","{""Oracle DBA"",RAC,ASM}",{Bangalore},JDSA9222,Active,High,INR,Work from Office,Permanent,job detail oracle installation configuration troubleshooting rac experience must least year oracle rdbms installation upgrade experience oracle db backup rman hot backup cold backup database refresh data pump tablespace management user management db lock session management tkprof awr ash sql plan sql profile etc oem shell scripting experience oracle database window environment added bonus oracle dba rac asm
